state,university/college,campus,student_enrollment,total_law_enforcement__employees,total_officers,total_civilians
UTAH,Weber State University,Weber State University main,25155.0,12.0,11.0,1.0
VERMONT,University of Vermont,University of Vermont main,12723.0,32.0,20.0,12.0
VIRGINIA,Christopher Newport University,Christopher Newport University main,5232.0,25.0,18.0,7.0
VIRGINIA,College of William and Mary,College of William and Mary main,8376.0,24.0,19.0,5.0
VIRGINIA,Eastern Virginia Medical School,Eastern Virginia Medical School main,1017.0,48.0,21.0,27.0
VIRGINIA,Emory and Henry College,Emory and Henry College main,959.0,4.0,2.0,2.0
VIRGINIA,Ferrum College,Ferrum College main,1512.0,9.0,9.0,0.0
VIRGINIA,George Mason University,George Mason University main,33917.0,77.0,50.0,27.0
VIRGINIA,Hampton University,Hampton University main,4622.0,51.0,29.0,22.0
VIRGINIA,James Madison University,James Madison University main,20181.0,41.0,31.0,10.0
VIRGINIA,J. Sargeant Reynolds Community College,J. Sargeant Reynolds Community College main,12454.0,21.0,13.0,8.0
VIRGINIA,Longwood University,Longwood University main,4960.0,21.0,15.0,6.0
VIRGINIA,Lord Fairfax Community College,Lord Fairfax Community College main,7238.0,2.0,2.0,0.0
VIRGINIA,Norfolk State University,Norfolk State University main,6728.0,42.0,26.0,16.0
VIRGINIA,Northern Virginia Community College,Northern Virginia Community College main,51803.0,54.0,46.0,8.0
VIRGINIA,Old Dominion University,Old Dominion University main,24828.0,56.0,42.0,14.0
VIRGINIA,Radford University,Radford University main,9928.0,33.0,24.0,9.0
VIRGINIA,Richard Bland College,Richard Bland College main,1428.0,3.0,3.0,0.0
VIRGINIA,Thomas Nelson Community College,Thomas Nelson Community College main,11033.0,15.0,10.0,5.0
VIRGINIA,University of Mary Washington,University of Mary Washington main,4831.0,21.0,15.0,6.0
VIRGINIA,University of Virginia's College at Wise,University of Virginia's College at Wise main,2291.0,10.0,9.0,1.0
VIRGINIA,University of Richmond,University of Richmond main,4140.0,35.0,22.0,13.0
VIRGINIA,University of Virginia,University of Virginia main,23464.0,128.0,52.0,76.0
VIRGINIA,Virginia Commonwealth University,Virginia Commonwealth University main,30974.0,130.0,88.0,42.0
VIRGINIA,Virginia Military Institute,Virginia Military Institute main,1675.0,11.0,10.0,1.0
VIRGINIA,Virginia Polytechnic Institute and State University,Virginia Polytechnic Institute and State University main,31205.0,69.0,45.0,24.0
VIRGINIA,Virginia State University,Virginia State University main,5763.0,34.0,19.0,15.0
VIRGINIA,Virginia Western Community College,Virginia Western Community College main,8654.0,9.0,9.0,0.0
WASHINGTON,Central Washington University,Central Washington University main,11287.0,15.0,13.0,2.0
WASHINGTON,Eastern Washington University,Eastern Washington University main,12791.0,14.0,13.0,1.0
WASHINGTON,Evergreen State College,Evergreen State College main,4398.0,15.0,9.0,6.0
WASHINGTON,University of Washington,University of Washington main,43762.0,73.0,41.0,32.0
WASHINGTON,Washington State University:,Washington State University: Pullman,27642.0,26.0,21.0,5.0
WASHINGTON,Washington State University:,Washington State University: Vancouver2,0.0,6.0,3.0,3.0
WASHINGTON,Western Washington University,Western Washington University main,14950.0,21.0,15.0,6.0
WISCONSIN,University of Wisconsin:,University of Wisconsin: Eau Claire,10923.0,12.0,11.0,1.0
WISCONSIN,University of Wisconsin:,University of Wisconsin: Green Bay,6668.0,12.0,10.0,2.0
WISCONSIN,University of Wisconsin:,University of Wisconsin: La Crosse,10520.0,13.0,9.0,4.0
WISCONSIN,University of Wisconsin:,University of Wisconsin: Madison,42677.0,131.0,70.0,61.0
WISCONSIN,University of Wisconsin:,University of Wisconsin: Milwaukee,27416.0,59.0,38.0,21.0
WISCONSIN,University of Wisconsin:,University of Wisconsin: Oshkosh,13900.0,13.0,11.0,2.0
WISCONSIN,University of Wisconsin:,University of Wisconsin: Parkside,4578.0,11.0,8.0,3.0
WISCONSIN,University of Wisconsin:,University of Wisconsin: Platteville,8712.0,10.0,8.0,2.0
WISCONSIN,University of Wisconsin:,University of Wisconsin: River Falls,6160.0,7.0,6.0,1.0
WISCONSIN,University of Wisconsin:,University of Wisconsin: Stevens Point,9661.0,5.0,2.0,3.0
WISCONSIN,University of Wisconsin:,University of Wisconsin: Stout,9313.0,11.0,9.0,2.0
WISCONSIN,University of Wisconsin:,University of Wisconsin: Superior,2661.0,7.0,2.0,5.0
WISCONSIN,University of Wisconsin:,University of Wisconsin: Whitewater,12027.0,15.0,13.0,2.0
WYOMING,Northern Wyoming Community College District,Northern Wyoming Community College District main,4437.0,4.0,4.0,0.0
WYOMING,University of Wyoming,University of Wyoming main,12778.0,23.0,13.0,10.0
"1 The student enrollment figures provided by the United States Department of Education are for the 2013 school year, the most recent available.  The enrollment figures include full-time and part-time students.  ",University of Wyoming,University of Wyoming main,0.0,0.0,0.0,0.0
2 Student enrollment figures were not available.,University of Wyoming,University of Wyoming main,0.0,0.0,0.0,0.0
