state,university/college,campus,student_enrollment1,violent_crime,murder_and_nonnegligent_manslaughter,rape_revised_definition2,rape_legacy_definition3,robbery,aggravated_assault,property_crime,burglary,larceny-_theft,motor_vehicle_theft,arson4
ALABAMA,Jacksonville State University,Jacksonville State University main,8693,1,0,0,0,0,1,61,11,49,1,0
ALABAMA,Jefferson State Community College,Jefferson State Community College main,8542,0,0,0,0,0,0,31,1,29,1,0
ALABAMA,Samford University,Samford University main,4833,1,0,0,0,0,1,39,1,37,1,0
ALABAMA,Troy University,Troy University main,20573,6,0,0,0,0,6,120,23,91,6,0
ALABAMA,Tuskegee University,Tuskegee University main,3118,16,0,5,0,3,8,173,16,150,7,0
ALABAMA,University of Alabama: ,University of Alabama:  Birmingham,18568,23,0,3,0,4,16,532,7,517,8,0
ALABAMA,University of Alabama: ,University of Alabama:  Huntsville,7376,0,0,0,0,0,0,75,30,45,0,0
ALABAMA,University of Alabama: ,University of Alabama:  Tuscaloosa,34752,23,0,8,0,4,11,431,42,382,7,0
ALABAMA,University of South Alabama,University of South Alabama main,15065,7,0,3,0,1,3,159,18,137,4,0
ALASKA,University of Alaska: ,University of Alaska:  Anchorage,17363,4,0,1,0,3,0,85,4,75,6,0
ALASKA,University of Alaska: ,University of Alaska:  Fairbanks,9166,1,0,0,0,0,1,59,4,55,0,0
ARIZONA,Central Arizona College,Central Arizona College main,6445,0,0,0,0,0,0,20,1,19,0,0
ARIZONA,Pima Community College,Pima Community College main,30082,0,0,0,0,0,0,125,8,114,3,0
ARIZONA,University of Arizona,University of Arizona main,40621,26,0,13,0,1,12,687,41,639,7,1
ARIZONA,Yavapai College,Yavapai College main,8197,0,0,0,0,0,0,12,3,9,0,0
ARKANSAS,Arkansas State University,Arkansas State University Jonesboro,13552,7,0,2,0,0,5,94,7,85,2,0
ARKANSAS,Arkansas Tech University,Arkansas Tech University main,11369,1,0,1,0,0,0,87,9,78,0,0
ARKANSAS,Henderson State University,Henderson State University main,3583,2,0,2,0,0,0,49,9,39,1,0
ARKANSAS,Southern Arkansas University Tech,Southern Arkansas University Tech main,1730,0,0,0,0,0,0,7,1,6,0,0
ARKANSAS,University of Arkansas: ,University of Arkansas:  Fayetteville,25341,3,0,1,0,1,1,230,32,168,30,1
ARKANSAS,University of Arkansas: ,University of Arkansas:  Little Rock,12377,13,0,0,0,2,11,135,13,117,5,0
ARKANSAS,University of Arkansas: ,University of Arkansas:  Medical Sciences,2867,2,0,0,0,0,2,125,2,123,0,0
ARKANSAS,University of Central Arkansas,University of Central Arkansas main,11534,6,0,1,0,1,4,101,10,90,1,0
CALIFORNIA,Allan Hancock College,Allan Hancock College main,10885,1,0,0,0,0,1,20,0,20,0,0
CALIFORNIA,California State Polytechnic University: ,California State Polytechnic University:  Pomona,22501,5,0,0,3,1,1,172,11,147,14,0
CALIFORNIA,California State Polytechnic University: ,California State Polytechnic University:  San Luis Obispo,19703,12,0,0,11,0,1,211,13,190,8,1
CALIFORNIA,California State University: ,California State University:  Bakersfield,8371,1,0,0,0,0,1,74,7,67,0,0
CALIFORNIA,California State University: ,California State University:  Channel Islands,5140,2,0,0,0,0,2,47,4,41,2,0
CALIFORNIA,California State University: ,California State University:  Chico,16356,8,0,0,4,0,4,260,11,247,2,0
CALIFORNIA,California State University: ,California State University:  Dominguez Hills5,14670,3,0,0,0,0,3,90,16,70,4,0
CALIFORNIA,California State University: ,California State University:  East Bay,14526,2,0,0,2,0,0,92,4,86,2,0
CALIFORNIA,California State University: ,California State University:  Fresno,23060,8,0,0,0,3,5,262,42,210,10,0
CALIFORNIA,California State University: ,California State University:  Fullerton,38325,8,0,0,5,1,2,169,12,145,12,0
CALIFORNIA,California State University: ,California State University:  Long Beach,35586,1,0,0,0,1,0,152,10,138,4,0
CALIFORNIA,California State University: ,California State University:  Los Angeles,23258,3,0,0,0,2,1,125,13,104,8,0
CALIFORNIA,California State University: ,California State University:  Monterey Bay,5732,7,0,0,5,1,1,67,8,57,2,0
CALIFORNIA,California State University: ,California State University:  Northridge,38310,6,0,0,1,2,3,326,10,310,6,0
CALIFORNIA,California State University: ,California State University:  Sacramento,28811,4,0,0,2,1,1,206,6,196,4,1
CALIFORNIA,California State University: ,California State University:  San Bernardino,18398,4,0,0,2,1,1,96,10,74,12,0
CALIFORNIA,California State University: ,California State University:  San Jose,31278,31,0,0,6,8,17,379,40,321,18,3
CALIFORNIA,California State University: ,California State University:  San Marcos,11300,8,0,0,7,0,1,68,6,62,0,0
CALIFORNIA,California State University: ,California State University:  Stanislaus,8917,1,0,0,1,0,0,57,4,52,1,0
CALIFORNIA,College of the Sequoias,College of the Sequoias main,10720,1,0,0,0,1,0,54,8,43,3,0
CALIFORNIA,Contra Costa Community College,Contra Costa Community College main,35676,5,0,0,0,5,0,186,21,147,18,0
CALIFORNIA,Cuesta College,Cuesta College main,9256,0,0,0,0,0,0,13,0,11,2,0
CALIFORNIA,El Camino College,El Camino College main,23996,3,0,0,0,3,0,109,9,92,8,0
CALIFORNIA,Foothill-De Anza College,Foothill-De Anza College main,38075,3,0,0,0,2,1,59,7,49,3,0
CALIFORNIA,Humboldt State University,Humboldt State University main,8293,3,0,0,2,1,0,115,7,106,2,3
CALIFORNIA,Marin Community College,Marin Community College main,6077,1,0,0,0,0,1,35,1,33,1,0
CALIFORNIA,Pasadena Community College,Pasadena Community College main,25268,2,0,0,0,1,1,62,0,61,1,1
CALIFORNIA,Riverside Community College,Riverside Community College main,36233,3,0,0,0,1,2,120,7,108,5,1
CALIFORNIA,San Bernardino Community College,San Bernardino Community College main,18026,11,0,0,0,0,11,101,18,65,18,0
CALIFORNIA,San Diego State University,San Diego State University main,31899,41,0,0,20,12,9,600,61,520,19,0
CALIFORNIA,San Francisco State University,San Francisco State University main,29905,4,0,0,1,1,2,188,35,147,6,0
CALIFORNIA,San Jose/Evergreen Community College ,San Jose/Evergreen Community College  main,18657,0,0,0,0,0,0,44,0,39,5,0
CALIFORNIA,Santa Rosa Junior College,Santa Rosa Junior College main,22094,5,0,0,0,0,5,73,4,67,2,1
CALIFORNIA,Sonoma State University,Sonoma State University main,9120,6,0,0,2,1,3,129,2,127,0,0
CALIFORNIA,State Center Community College District,State Center Community College District main,35151,6,0,0,0,5,1,224,28,178,18,0
CALIFORNIA,University of California: ,University of California:  Berkeley,36198,41,0,0,6,28,7,1010,57,922,31,9
CALIFORNIA,University of California: ,University of California:  Davis,33307,17,0,0,10,2,5,527,22,500,5,1
CALIFORNIA,University of California: ,University of California:  Hastings College of Law,1088,13,0,0,0,2,11,34,1,33,0,0
CALIFORNIA,University of California: ,University of California:  Irvine,28895,26,0,0,5,0,21,356,38,301,17,2
CALIFORNIA,University of California: ,University of California:  Los Angeles,40795,114,0,0,21,16,77,922,212,690,20,1
CALIFORNIA,University of California: ,"University of California:  Medical Center, Sacramento6",0,5,0,0,0,2,3,175,18,151,6,1
CALIFORNIA,University of California: ,University of California:  Merced,6195,0,0,0,0,0,0,32,2,29,1,0
CALIFORNIA,University of California: ,University of California:  Riverside5,21207,6,0,2,0,2,2,286,19,258,9,2
CALIFORNIA,University of California: ,University of California:  San Diego,29517,4,0,0,2,1,1,542,34,493,15,1
CALIFORNIA,University of California: ,University of California:  San Francisco,3079,9,0,0,0,4,5,369,34,323,12,1
CALIFORNIA,University of California: ,University of California:  Santa Barbara,22225,17,0,0,9,4,4,249,15,233,1,0
CALIFORNIA,University of California: ,University of California:  Santa Cruz,17203,14,0,0,5,2,7,214,27,181,6,2
CALIFORNIA,Ventura County Community College District,Ventura County Community College District main,34053,0,0,0,0,0,0,71,0,71,0,0
CALIFORNIA,West Valley-Mission College,West Valley-Mission College main,18766,2,0,0,0,0,2,23,2,19,2,0
COLORADO,Adams State University,Adams State University main,3211,0,0,0,0,0,0,55,1,53,1,0
COLORADO,Aims Community College,Aims Community College main,4955,0,0,0,0,0,0,2,0,2,0,0
COLORADO,Arapahoe Community College,Arapahoe Community College main,11621,0,0,0,0,0,0,3,0,3,0,0
COLORADO,Auraria Higher Education Center6,Auraria Higher Education Center6 main,0,0,0,0,0,0,0,211,13,190,8,0
COLORADO,Colorado School of Mines,Colorado School of Mines main,5790,2,0,1,0,0,1,77,2,75,0,0
COLORADO,Colorado State University,Colorado State University Fort Collins,31186,9,0,7,0,0,2,239,17,215,7,5
COLORADO,Fort Lewis College,Fort Lewis College main,4021,2,0,1,0,0,1,53,5,47,1,0
COLORADO,Pikes Peak Community College,Pikes Peak Community College main,14634,1,0,1,0,0,0,21,0,21,0,0
COLORADO,University of Colorado:,University of Colorado: Boulder,32017,18,0,9,0,3,6,408,26,369,13,5
COLORADO,University of Colorado:,University of Colorado: Colorado Springs,11321,1,0,0,0,0,1,61,5,55,1,1
COLORADO,University of Colorado:,University of Colorado: Denver,22206,0,0,0,0,0,0,49,7,39,3,0
COLORADO,University of Colorado:,University of Colorado: Health Sciences Center6,0,0,0,0,0,0,0,19,19,0,0,0
COLORADO,University of Northern Colorado,University of Northern Colorado main,12710,3,0,2,0,0,1,109,2,107,0,1
CONNECTICUT,Central Connecticut State University,Central Connecticut State University main,11865,0,0,0,0,0,0,30,10,19,1,0
CONNECTICUT,Eastern Connecticut State University,Eastern Connecticut State University main,5368,1,0,0,0,1,0,51,0,50,1,0
CONNECTICUT,Southern Connecticut State University,Southern Connecticut State University main,10804,1,0,0,0,1,0,47,0,47,0,0
CONNECTICUT,University of Connecticut: ,University of Connecticut:  Health Center6,0,2,0,0,0,0,2,15,0,15,0,0
CONNECTICUT,University of Connecticut: ,"University of Connecticut:  Storrs, Avery Point, and Hartford6",0,16,0,6,0,2,8,243,33,197,13,3
CONNECTICUT,Western Connecticut State University,Western Connecticut State University main,6025,1,0,1,0,0,0,42,2,40,0,0
CONNECTICUT,Yale University,Yale University main,12109,3,0,0,0,3,0,300,34,265,1,0
DELAWARE,Delaware State University,Delaware State University main,4336,13,0,7,0,0,6,89,6,80,3,0
DELAWARE,University of Delaware,University of Delaware main,22166,13,0,6,0,2,5,216,26,188,2,0
FLORIDA,Edison State College,Edison State College main,15423,3,0,0,0,0,3,15,3,11,1,0
FLORIDA,Florida A&M University,Florida A&M University main,10743,10,0,2,0,3,5,169,11,144,14,0
FLORIDA,Florida Atlantic University,Florida Atlantic University main,30759,5,0,3,0,0,2,173,20,138,15,1
FLORIDA,Florida Gulf Coast University,Florida Gulf Coast University main,14077,5,0,3,0,2,0,65,0,64,1,1
FLORIDA,Florida International University,Florida International University main,47663,9,0,1,0,3,5,390,25,356,9,0
FLORIDA,Florida State University:,Florida State University: Panama City6,0,0,0,0,0,0,0,8,1,7,0,0
FLORIDA,Florida State University:,Florida State University: Tallahassee,40909,15,0,7,0,3,5,359,46,290,23,0
FLORIDA,New College of Florida,New College of Florida main,793,2,0,2,0,0,0,22,0,22,0,1
FLORIDA,Pensacola State College,Pensacola State College main,11235,0,0,0,0,0,0,43,2,39,2,0
FLORIDA,Santa Fe College,Santa Fe College main,15113,1,0,0,0,0,1,27,1,26,0,0
FLORIDA,Tallahassee Community College,Tallahassee Community College main,13509,4,0,0,0,1,3,59,0,58,1,0
FLORIDA,University of Central Florida,University of Central Florida main,59589,29,0,14,0,5,10,385,29,345,11,0
FLORIDA,University of Florida,University of Florida main,49878,15,0,4,0,1,10,594,28,554,12,0
FLORIDA,University of North Florida,University of North Florida main,16083,4,0,2,0,1,1,112,11,101,0,0
FLORIDA,University of South Florida: ,University of South Florida:  St. Petersburg,4660,3,0,3,0,0,0,39,4,34,1,1
FLORIDA,University of South Florida: ,University of South Florida:  Tampa,41428,12,0,4,0,3,5,377,37,331,9,0
FLORIDA,University of West Florida,University of West Florida main,12588,6,0,5,0,0,1,76,8,67,1,0
GEORGIA7,Abraham Baldwin Agricultural College,Abraham Baldwin Agricultural College main,3394,0,0,0,0,0,0,46,5,40,1,0
GEORGIA7,Agnes Scott College,Agnes Scott College main,915,0,0,0,0,0,0,8,0,7,1,0
GEORGIA7,Albany State University,Albany State University main,4260,1,0,0,0,1,0,39,4,33,2,0
GEORGIA7,Andrew College,Andrew College main,316,0,0,0,0,0,0,5,0,5,0,0
GEORGIA7,Armstrong Atlantic State University,Armstrong Atlantic State University main,7101,0,0,0,0,0,0,31,3,28,0,0
GEORGIA7,Augusta Technical College,Augusta Technical College main,4379,0,0,0,0,0,0,3,0,3,0,0
GEORGIA7,Bainbridge State College,Bainbridge State College main,2695,0,0,0,0,0,0,0,0,0,0,0
GEORGIA7,Berry College,Berry College main,2223,1,0,0,1,0,0,46,3,43,0,0
GEORGIA7,Chattahoochee Technical College,Chattahoochee Technical College main,10470,1,0,0,1,0,0,8,1,7,0,0
GEORGIA7,College of Coastal Georgia,College of Coastal Georgia main,2987,0,0,0,0,0,0,26,1,25,0,0
GEORGIA7,Columbus State University,Columbus State University main,8156,1,0,0,0,0,1,68,7,59,2,1
GEORGIA7,Dalton State College,Dalton State College main,5015,0,0,0,0,0,0,4,1,3,0,0
GEORGIA7,Darton State College,Darton State College main,6195,0,0,0,0,0,0,55,5,50,0,0
GEORGIA7,Emory University,Emory University main,14513,18,0,0,15,0,3,465,22,424,19,0
GEORGIA7,Fort Valley State University,Fort Valley State University main,3180,1,0,0,1,0,0,16,0,16,0,0
GEORGIA7,Georgia College and State University,Georgia College and State University main,6551,6,0,0,6,0,0,50,5,44,1,0
GEORGIA7,Georgia Gwinnett College,Georgia Gwinnett College main,9719,6,0,0,0,0,6,184,2,179,3,0
GEORGIA7,Georgia Institute of Technology,Georgia Institute of Technology main,21471,20,0,0,5,10,5,381,52,308,21,0
GEORGIA7,Georgia Military College,Georgia Military College main,1651,0,0,0,0,0,0,2,0,2,0,0
GEORGIA7,Georgia Perimeter College,Georgia Perimeter College main,21123,0,0,0,0,0,0,89,0,86,3,0
GEORGIA7,Georgia Regents University,Georgia Regents University main,8468,0,0,0,0,0,0,96,2,92,2,0
GEORGIA7,Georgia Southern University,Georgia Southern University main,20517,7,0,0,5,2,0,169,8,161,0,0
GEORGIA7,Georgia State University,Georgia State University main,32165,12,0,0,3,5,4,250,3,238,9,0
GEORGIA7,Gordon State College,Gordon State College main,4187,3,0,0,3,0,0,39,7,32,0,0
GEORGIA7,Gwinnett Technical College,Gwinnett Technical College main,7180,0,0,0,0,0,0,7,0,7,0,1
GEORGIA7,Kennesaw State University,Kennesaw State University main,24629,12,0,0,10,1,1,119,8,111,0,0
GEORGIA7,Mercer University,Mercer University main,8351,3,0,0,0,3,0,59,3,54,2,0
GEORGIA7,Morehouse College,Morehouse College main,2170,6,0,0,0,4,2,105,8,97,0,0
GEORGIA7,Paine College,Paine College main,924,2,0,0,0,0,2,11,10,0,1,0
GEORGIA7,Piedmont College,Piedmont College main,2368,0,0,0,0,0,0,0,0,0,0,0
GEORGIA7,Savannah State University,Savannah State University main,4772,4,0,0,0,4,0,144,17,126,1,0
GEORGIA7,Southern Crescent Technical College,Southern Crescent Technical College main,5177,0,0,0,0,0,0,4,0,4,0,0
GEORGIA7,Southern Polytechnic State University,Southern Polytechnic State University main,6549,1,0,0,0,1,0,58,3,54,1,0
GEORGIA7,South Georgia State College,South Georgia State College main,2579,0,0,0,0,0,0,9,1,8,0,0
GEORGIA7,Spelman College,Spelman College main,2129,4,0,0,2,2,0,25,4,21,0,0
GEORGIA7,University of Georgia,University of Georgia main,34536,75,0,0,70,2,3,450,68,374,8,1
GEORGIA7,University of North Georgia,University of North Georgia main,15455,0,0,0,0,0,0,53,0,53,0,0
GEORGIA7,University of West Georgia,University of West Georgia main,11929,7,0,0,1,3,3,168,11,157,0,0
GEORGIA7,Valdosta State University,Valdosta State University main,11885,1,0,0,0,1,0,188,13,173,2,0
GEORGIA7,West Georgia Technical College,West Georgia Technical College main,6915,0,0,0,0,0,0,25,0,25,0,0
GEORGIA7,Young Harris College,Young Harris College main,1117,1,0,0,0,0,1,3,0,3,0,0
ILLINOIS,Benedictine University,Benedictine University Lisle,6318,3,0,0,0,2,1,23,1,21,1,0
ILLINOIS,Black Hawk College: ,Black Hawk College:  Kewanee6,0,0,0,0,0,0,0,3,1,2,0,0
ILLINOIS,Black Hawk College: ,Black Hawk College:  Moline,6574,0,0,0,0,0,0,17,2,15,0,0
ILLINOIS,Chicago State University,Chicago State University main,5701,0,0,0,0,0,0,69,2,61,6,0
ILLINOIS,College of DuPage,College of DuPage main,28627,1,0,0,0,0,1,55,2,52,1,0
ILLINOIS,College of Lake County,College of Lake County main,17685,0,0,0,0,0,0,62,11,51,0,0
ILLINOIS,Elgin Community College,Elgin Community College main,11285,0,0,0,0,0,0,16,0,15,1,0
ILLINOIS,Harper College,Harper College main,14830,0,0,0,0,0,0,36,1,35,0,1
ILLINOIS,Illinois Central College,Illinois Central College main,10770,0,0,0,0,0,0,35,3,32,0,0
ILLINOIS,John A. Logan College,John A. Logan College main,7150,1,0,0,0,0,1,12,3,9,0,0
ILLINOIS,Joliet Junior College,Joliet Junior College main,16869,0,0,0,0,0,0,33,1,32,0,0
ILLINOIS,Lake Land College,Lake Land College main,6351,0,0,0,0,0,0,6,0,6,0,0
ILLINOIS,Lewis University,Lewis University main,6525,1,0,1,0,0,0,27,1,26,0,0
ILLINOIS,Loyola University,Loyola University main,15957,17,1,3,0,11,2,133,8,124,1,0
ILLINOIS,McHenry County College,McHenry County College main,7023,0,0,0,0,0,0,5,1,4,0,0
ILLINOIS,Millikin University,Millikin University main,2261,0,0,0,0,0,0,33,3,30,0,0
ILLINOIS,Moraine Valley Community College,Moraine Valley Community College main,16106,1,0,0,0,0,1,57,0,56,1,0
ILLINOIS,Morton College,Morton College main,4886,0,0,0,0,0,0,19,0,18,1,0
ILLINOIS,Northern Illinois University,Northern Illinois University main,21138,15,0,6,0,1,8,192,8,180,4,7
ILLINOIS,Northwestern University,Northwestern University Evanston,21592,8,0,2,0,2,4,213,34,179,0,0
ILLINOIS,Oakton Community College,Oakton Community College main,10866,0,0,0,0,0,0,13,0,13,0,0
ILLINOIS,Parkland College,Parkland College main,8437,1,0,0,0,0,1,25,2,23,0,0
ILLINOIS,Rend Lake College,Rend Lake College main,2714,0,0,0,0,0,0,8,0,7,1,0
ILLINOIS,Southern Illinois University:,Southern Illinois University: Carbondale,17964,16,0,8,0,1,7,228,37,191,0,0
ILLINOIS,Southern Illinois University:,Southern Illinois University: Edwardsville,13850,5,0,0,0,2,3,123,9,112,2,0
ILLINOIS,Southern Illinois University:,Southern Illinois University: School of Medicine6,0,0,0,0,0,0,0,1,0,1,0,0
ILLINOIS,South Suburban College,South Suburban College main,5212,0,0,0,0,0,0,19,0,19,0,0
ILLINOIS,Southwestern Illinois College,Southwestern Illinois College main,11332,1,0,0,0,0,1,35,1,31,3,0
ILLINOIS,University of Chicago,University of Chicago Cook County,15048,15,0,0,0,9,6,256,16,240,0,1
ILLINOIS,University of Illinois: ,University of Illinois:  Chicago,28038,5,0,1,0,4,0,335,4,328,3,0
ILLINOIS,University of Illinois: ,University of Illinois:  Springfield,5137,2,0,1,0,0,1,49,8,41,0,0
ILLINOIS,University of Illinois: ,University of Illinois:  Urbana,44942,29,0,2,0,8,19,343,12,330,1,2
ILLINOIS,Western Illinois University,Western Illinois University main,11707,15,0,6,0,1,8,113,9,102,2,2
INDIANA,Ball State University,Ball State University main,20503,7,0,6,0,0,1,236,43,189,4,0
INDIANA,Butler University,Butler University main,4827,6,0,6,0,0,0,121,13,105,3,0
INDIANA,Indiana State University,Indiana State University main,12448,9,0,0,0,1,8,250,6,242,2,0
INDIANA,Indiana University:,Indiana University: Bloomington5,46817,8,0,2,0,2,4,370,20,345,5,0
INDIANA,Indiana University:,Indiana University: Indianapolis5,30488,9,0,3,0,5,1,282,32,243,7,0
INDIANA,Indiana University:,Indiana University: Northwest5,6387,0,0,0,0,0,0,36,1,35,0,0
INDIANA,Indiana University:,Indiana University: Southeast5,6733,0,0,0,0,0,0,16,1,15,0,0
INDIANA,Marian University,Marian University main,2714,2,0,0,1,0,1,45,5,39,1,0
INDIANA,Purdue University,Purdue University main,39794,6,1,0,2,1,2,357,25,329,3,1
IOWA,Iowa State University,Iowa State University main,32955,12,0,7,0,0,5,217,17,199,1,2
IOWA,University of Iowa,University of Iowa main,29748,12,0,8,0,2,2,198,15,179,4,0
IOWA,University of Northern Iowa,University of Northern Iowa main,12159,5,0,3,0,0,2,72,3,69,0,1
KANSAS,Fort Hays State University,Fort Hays State University main,13441,0,0,0,0,0,0,25,8,17,0,0
KANSAS,Kansas City Kansas Community College,Kansas City Kansas Community College main,6570,0,0,0,0,0,0,46,0,45,1,0
KANSAS,Kansas State University,Kansas State University main,24581,2,0,0,0,0,2,75,2,71,2,0
KANSAS,Pittsburg State University,Pittsburg State University main,7400,5,0,2,0,0,3,60,6,53,1,0
KANSAS,University of Kansas: ,University of Kansas:  Main Campus,26968,9,0,5,0,1,3,211,32,177,2,0
KANSAS,University of Kansas: ,University of Kansas:  Medical Center6,0,7,0,0,0,0,7,141,5,134,2,1
KANSAS,Washburn University,Washburn University main,6973,3,0,2,0,0,1,62,3,55,4,0
KANSAS,Wichita State University,Wichita State University main,14386,3,0,1,0,0,2,64,2,59,3,0
KENTUCKY,Eastern Kentucky University,Eastern Kentucky University main,16111,7,0,4,0,3,0,149,30,119,0,0
KENTUCKY,Kentucky State University,Kentucky State University main,2533,2,0,0,0,1,1,45,2,42,1,1
KENTUCKY,Morehead State University,Morehead State University main,11358,0,0,0,0,0,0,77,33,44,0,0
KENTUCKY,Murray State University,Murray State University main,10943,6,0,6,0,0,0,100,12,87,1,5
KENTUCKY,Northern Kentucky University,Northern Kentucky University main,15263,1,0,1,0,0,0,50,1,49,0,0
KENTUCKY,University of Kentucky,University of Kentucky main,28435,8,0,1,0,3,4,418,20,389,9,1
KENTUCKY,University of Louisville,University of Louisville main,21444,10,0,0,0,8,2,261,34,216,11,0
KENTUCKY,Western Kentucky University,Western Kentucky University main,20448,1,0,0,0,1,0,134,18,114,2,0
LOUISIANA,Delgado Community College5,Delgado Community College5 main,18698,1,0,0,0,0,1,14,2,11,1,0
LOUISIANA,Grambling State University5,Grambling State University5 main,5071,29,0,1,0,1,27,154,47,105,2,0
LOUISIANA,Louisiana State University: ,Louisiana State University:  Baton Rouge5,30478,13,0,3,0,6,4,410,47,355,8,1
LOUISIANA,Louisiana State University: ,"Louisiana State University:  Health Sciences Center, New Orleans",2829,0,0,0,0,0,0,0,0,0,0,0
LOUISIANA,Louisiana State University: ,"Louisiana State University:  Health Sciences Center, Shreveport5",856,1,0,0,0,0,1,40,8,32,0,0
LOUISIANA,Louisiana State University: ,Louisiana State University:  Shreveport5,4114,1,0,0,0,0,1,17,0,16,1,0
LOUISIANA,Louisiana Tech University5,Louisiana Tech University5 main,11015,2,0,0,0,1,1,81,12,67,2,0
LOUISIANA,Nicholls State University5,Nicholls State University5 main,6532,1,0,1,0,0,0,29,2,27,0,0
LOUISIANA,Northwestern State University,Northwestern State University main,8944,2,0,2,0,0,0,81,14,64,3,0
LOUISIANA,Southern University and A&M College: ,Southern University and A&M College:  Baton Rouge,6777,7,0,1,0,3,3,114,15,98,1,1
LOUISIANA,Southern University and A&M College: ,Southern University and A&M College:  Shreveport5,3018,0,0,0,0,0,0,10,0,9,1,0
LOUISIANA,Tulane University5,Tulane University5 main,12938,5,0,2,0,3,0,298,13,283,2,1
LOUISIANA,University of Louisiana: ,University of Louisiana:  Lafayette5,16646,22,0,0,0,2,20,181,29,148,4,0
LOUISIANA,University of Louisiana: ,University of Louisiana:  Monroe,8645,4,0,2,0,1,1,70,3,65,2,0
LOUISIANA,University of New Orleans5,University of New Orleans5 main,9323,3,0,0,0,0,3,91,13,76,2,0
MAINE,University of Maine: ,University of Maine:  Farmington,2061,0,0,0,0,0,0,9,0,9,0,0
MAINE,University of Maine: ,University of Maine:  Orono,11247,2,0,0,1,0,1,139,10,128,1,2
MAINE,University of Southern Maine,University of Southern Maine main,8923,1,0,0,0,0,1,33,2,31,0,0
MARYLAND,Bowie State University,Bowie State University main,5561,7,0,0,2,1,4,57,26,30,1,0
MARYLAND,Coppin State University,Coppin State University main,3383,5,0,0,0,4,1,69,22,44,3,0
MARYLAND,Frostburg State University,Frostburg State University main,5473,2,0,0,2,0,0,29,9,20,0,0
MARYLAND,Hagerstown Community College,Hagerstown Community College main,4905,1,0,0,1,0,0,3,3,0,0,0
MARYLAND,Morgan State University,Morgan State University main,7546,20,0,0,0,15,5,136,15,117,4,0
MARYLAND,Salisbury University,Salisbury University main,8643,3,0,0,1,0,2,102,3,98,1,0
MARYLAND,St. Mary's College,St. Mary's College main,1858,4,0,0,3,0,1,72,8,64,0,0
MARYLAND,Towson University,Towson University main,22499,7,0,0,2,0,5,101,10,90,1,0
MARYLAND,University of Baltimore,University of Baltimore main,6518,0,0,0,0,0,0,39,0,38,1,0
MARYLAND,University of Maryland: ,University of Maryland:  Baltimore City,6284,20,0,0,0,12,8,74,3,68,3,0
MARYLAND,University of Maryland: ,University of Maryland:  Baltimore County,13908,1,0,0,1,0,0,126,6,119,1,0
MARYLAND,University of Maryland: ,University of Maryland:  College Park,37272,5,0,0,0,3,2,459,69,349,41,2
MARYLAND,University of Maryland: ,University of Maryland:  Eastern Shore,4220,6,0,0,2,2,2,67,21,45,1,0
MASSACHUSETTES,Amherst College,Amherst College main,1785,12,0,0,11,0,1,52,4,48,0,0
MASSACHUSETTES,Assumption College,Assumption College main,2756,7,0,5,0,0,2,20,4,16,0,0
MASSACHUSETTES,Becker College,Becker College main,1902,1,0,0,0,0,1,10,0,10,0,0
MASSACHUSETTES,Boston College,Boston College main,14309,11,0,0,8,0,3,133,4,129,0,0
MASSACHUSETTES,Boston University,Boston University main,32411,21,0,4,0,2,15,302,15,283,4,0
MASSACHUSETTES,Brandeis University,Brandeis University main,5825,4,0,0,4,0,0,64,3,61,0,0
MASSACHUSETTES,Bridgewater State University,Bridgewater State University main,11267,8,0,7,0,0,1,60,5,55,0,1
MASSACHUSETTES,Bristol Community College,Bristol Community College main,9335,0,0,0,0,0,0,13,0,13,0,0
MASSACHUSETTES,Bunker Hill Community College,Bunker Hill Community College main,14023,2,0,0,0,1,1,74,1,73,0,0
MASSACHUSETTES,Cape Cod Community College,Cape Cod Community College main,4051,0,0,0,0,0,0,1,0,1,0,0
MASSACHUSETTES,Clark University,Clark University main,3551,5,0,0,1,1,3,59,2,56,1,0
MASSACHUSETTES,"Dean College5, 7","Dean College5, 7 main",1300,3,0,1,0,0,2,35,1,34,0,0
MASSACHUSETTES,Emerson College,Emerson College main,4561,10,0,0,5,2,3,68,11,57,0,0
